{
  "$schema_file": "../schemas/micro-consultation-response.schema.json",
  "schema": "micro_consultation_response",
  "schema_version": "0.1",
  "task_id": "devswitchboard-unknown-local-context-010",
  "revision": 1,
  "consultation_id": "CONS-010-001",
  "status": "answered",
  "requester": "chat",
  "responder": "codex",
  "phase_owner": "chat",
  "consultation_type": "repository_fact",
  "in_response_to": {
    "consultation_id": "CONS-010-001",
    "request_revision": 1
  },
  "finding": "No preserved local worktree contains an uncommitted or unpushed local-only change to docs/getting-started.md that is absent from origin/main at 34dcefa32a2429cd804135899e8eeb5d84fd1952 and material to the proposed bounded edit.",
  "evidence": [
    "The remote-advertised main branch was 34dcefa32a2429cd804135899e8eeb5d84fd1952 when CONS-010-001 was answered.",
    "All six registered worktrees had a clean docs/getting-started.md.",
    "The main and Dogfood #009 worktrees were at the supplied baseline with the baseline target-file content.",
    "The Dogfood #004, #006, #007, and #008 worktrees were clean historical branches behind the supplied baseline; none had a commit outside the baseline that modified the target file."
  ],
  "implication": [
    "The possibly material UNKNOWN local relation is resolved with high-confidence focused evidence and does not require a Local Delta because no relevant local-only target truth exists.",
    "This fact does not choose the execution route; Chat remains phase owner and decision authority."
  ],
  "decision": "none"
}
